n_linea,ctexto1,ctexto2,distancia,texto1,texto2
3198,93,0,93,úna vez sancnada postbramentela operación pasa al departamento de administración para que sea,
3199,7,0,7,tomalza,
3200,13,13,0,formalización,formalización
3201,88,106,21,el departamento e esgos niza un aplcao espectio ara su trabajo denominado gestón elscónc,el departamento de riesgos utiliza un aplicativo específico para su trabajo denominado gestión electrónica
3202,89,99,19,"ocsmentl (g£0), medant el ua todo los documerins e las operaciones de scbro on escaneados","documental (ged), mediante el cual todos los documentos de las operaciones de activo son escaneados"
3203,98,103,7,antes de pasar a departamento de lsgos de tal modo que todo el personal del departamento abeja con,antes de pasar al departamento de riesgos de tal modo que todo el personal del departamento trabaja con
3204,21,25,7,"specientes eletóncos,",expedientes electrónicos.
3205,92,101,14,asi mismo a través de cho plosivo se conto en todo momento el estado y stueción ds todas las,así mismo a través de dicho aplicativo se controla en todo momento el estado y situación de todas las
3206,95,104,12,operaciones de acto habiéndose definido los cuentes ssidos en ls que e puede encontrr cualquier,operaciones de activo habiéndose definido los siguientes estados en los que se puede encontrar cualquier
3207,17,20,3,peración de acto:,operación de activo:
3208,10,13,4,- enotcna.,- en oficina.
3209,88,98,15,7. envaca a aervios centrales para su análss y pendiente de reir ocumentacón obligatoria,- enviada a servicios centrales para su análisis y pendiente de recibir documentación obligatoria.
3210,24,37,17,— perder de asar aun ara,- pendiente de asignar a un analista.
3211,46,31,27,7 analizancosefridcamente pora asesoría juída.,- analizándose por un analista.
3212,45,31,33,= penalente de sancón por órgano conespondert,- condicionada por el analista.
3213,36,54,37,= sancionada y pendiente de ormatzar,- analizándose jurídicamente por la asesoría jurídica.
3214,69,53,47,7 femmatzaca y pendiente de eco al contrato frmado (póliza escritura),- pendiente de sanción por el órgano correspondiente.
3215,3,39,37,red,- sancionada y pendiente de formalizar.
3216,97,77,74,"aparte de conocer puntualmente el estado en que se encuentra cada operación, el sistema geo da ur",- formalizada y pendiente de recibir el contrato firmado (póliza o escritura)
3217,93,12,86,(rezabldsd completa del mamo viendo os dsinos estados porlos que ha pasado lechas personas ue,- archivada.
3218,29,98,78,"han manejado el expedito, et.","aparte de conocer puntualmente el estado en que se encuentra cada operación, el sistema ged da una"
3219,18,104,91,armeuciones | amar,"trazabilidad completa del mismo viendo los distintos estados por los que ha pasado, fechas, personas que"
3220,26,32,27,comisión ejecutiva 2000000,"han manejado el expediente, etc."
3221,18,42,35,comisencslegada ej,atribuciones para operaciones hipotecarias
3222,0,12,12,,atribuciones
3223,0,13,13,,garantia real
3224,0,18,18,,comisión ejecutiva
3225,0,18,18,,comisión colegiada
3226,0,16,16,,director general
3227,0,20,20,,director area inver.
3228,0,20,20,,director area comer.
3229,0,19,19,,director area empr.
3230,0,19,19,,director dpto. viv.
3231,0,8,8,,analista
3232,0,16,16,,director oficina
3233,0,15,15,,gestor vivienda
3234,0,12,12,,jefe de zona
3235,0,25,25,,responsable banca privada
3236,22,22,0,seguimiento del riesgo,seguimiento del riesgo
3237,94,103,13,una toma de prevenirla morosidad s esta atento a ceras señales de slerma. las más habruals on:,una forma de prevenir la morosidad es estar atento a ciertas señales de alarma. las más habituales son:
3238,59,61,12,- > patones conindas de renovaciones y apszamients de pago.,peticiones continúas de renovaciones y aplazamientos de pago.
3239,80,93,15,útrecmieno de enovara deuda medint a enrega de pagarés oras con vencimientos muy,ofrecimiento de renovar la deuda mediante la entrega de pagarés o letras con vencimientos muy
3240,31,8,27,úisminuciones en su patrimonio.,tardíos.
3241,94,31,76,la úlima fase del proceso son las muevas vías juiisles. las operaciones incobrables por la vía,disminuciones en su patrimonio.
3242,89,97,77,"amistosa, muchas veces se cobren an el momento en que 6 noia al moroso la nerposicón de u",la última fase del proceso son las nuevas vías judiciales. las operaciones incobrables por la vía
3243,90,99,72,demanda judical le entrada en vigor de la nueva ley de anjuciamiento cl inrdijo dos nuevas,"amistosa, muchas veces se cobran en el momento en que se notifica al moroso la interposición de una"
3244,86,98,76,"firmada precesces el ju sanoaro y proceso monton, que acian y reducan los gasa y lempo",demanda judicial. la entrada en vigor de la nueva ley de enjuiciamiento civil introdujo dos nuevas
3245,16,108,95,"el receso simio,","fórmulas procesales, el juicio cambiario y proceso monitorio, que facilitan y reducen los gastos y el tiempo"
3246,0,22,22,,del proceso al máximo.
3247,22,22,0,método de recuperación,método de recuperación
3248,87,96,9,"el método de recuperación se compone de una secuencia de acciones cats, lamadas teóncas","el método de recuperación se compone de una secuencia de acciones: cartas, llamadas telefónicas,"
3249,93,97,9,"bloqueos de posicones reclamadas y relacionadas, slo. no obstante, el gestor puede sololar la","bloqueos de posiciones reclamadas y relacionadas, etc.; no obstante, el gestor puede solicitar la"
3250,48,52,8,"realzación de aras gestores que estime cporunas,",realización de otras gestiones que estime oportunas.
3251,60,74,16,"estas acciones que ss reelzan d menor a mayor nena, e gen a:","estas acciones, que se realizan de menor a mayor intensidad, se dirigen a:"
3252,54,65,17,> las personas queintanienen en a cuena (lares y vals),las personas que intervienen en la cuenta (titulares y avalistas)
3253,94,95,6,2 las cuentas objeto de reclamación o cuentes relacionadas mediante a estrición de operatoria.,las cuentas objeto de reclamación o cuentas relacionadas mediante la restricción de operatoria.
3254,56,58,6,2 los gestores que tenen responsablidad ena recuperación,los gestores que tienen responsabilidad en la recuperación
3255,87,95,11,e métado de recuperación coespondient a préstamos con garantia iotecaria es el siqiete:,el método de recuperación correspondiente a préstamos con garantía hipotecaria es el siguiente:
3256,70,81,11,la aplcación infomática genera un ser de ass y recamacios automáticas:,la aplicación informática genera una serie de avisos y reclamaciones automáticas:
3257,68,98,35,+ aloe 30 días desde fecha primer impago: 19 cara al lr. plazo de 10,a los 30 días desde fecha primer impago: 1ª carta al titular. plazo de 10 días para regularizar la
3258,18,20,4,«tuscin de impago.,situación de impago.
3259,85,93,13,+ alo 60 días desde fecha pimor mpago: 2 cana al tular y avalstas (20 das después del,a los 60 días desde fecha primer impago: 2ª carta al titular y avalistas (20 días después del
3260,39,43,5,vencimiento del plazo de a prmera caña),vencimiento del plazo de la primera carta).
3261,47,50,7,+ los 90 dias desde fecha prior impago: 3 caña.,a los 90 días desde fecha primer impago: 3ª carta.
3262,22,102,84,as para regularizar la,el departamento realiza un control de plazos al margen del sistema informático. realiza las siguientes
3263,92,7,86,el deparamento realza un col de plazos al margen del sistema intomátco.reslza las siguiente.,tareas:
3264,84,88,10,» plazo 1: primera cat que se manda cuendo el préstamo leva 2 3 cuolasimpagadas o la,plazo 1: primera carta que se manda cuando el préstamo lleva 2 o 3 cuotas impagadas o la
3265,84,98,17,cuenta leva en descubieno de 45 0 das a tulrs y avalistas. se le requiero al ceo que,cuenta lleva en descubierto de 45 a 60 días a titulares y avalistas. se le requiere al cliente que
3266,32,38,6,regulac a siuación en 10/15 días,regularice la situación en 10/15 días.
3267,86,88,7,"+ plazo 2. segunda cara, e envía con más de 4 cuotas impagadas o descubierto de más de","plazo 2: segunda carta, se envía con más de 4 cuotas impagadas o descubierto de más de 3"
3268,70,81,13,meses iulares y avalitas. el plazo que sel deal tente s de una semana.,meses a titulares y avalistas. el plazo que se le da al cliente es de una semana.
3269,68,107,39,"una vez agotados estos plazos ys elclene no haregulaizado su suacón,","una vez agotados estos plazos y si el cliente no ha regularizado su situación, se realizazan las siguientes"
3270,23,9,19,restzazan las siguentes,acciones:
3271,92,98,15,"1. esperar lelclent está esperando una operación. ransterenci, et. que permita reguarizar la","esperar si el cliente está esperando una operación, transferencia, etc. que permita regularizar la"
3272,86,93,14,"atúeción, se solota al chente tod la documentación necesaria que acredite la espera pe",situación. se solicita al cliente toda la documentación necesaria que acredite la espera para
3273,46,47,1,poder establecer un tempo máximo de respuesta.,poder establecer un tiempo máximo de respuesta.
3274,87,94,14,2. llegar a un acuerdo con el cnt paar pagando la deuda poco a poco. eta tpo de cuerdos,llegar a un acuerdo con el cliente para ir pagando la deuda poco a poco. este tipo de acuerdos
3275,83,93,12,"sólo se resizaá con lentes que no tenen ingún tipo de soencl, y no hay ora forma de","sólo se realizará con clientes que no tienen ningún tipo de solvencia, y no hay otra forma de"
3276,83,91,14,"recuperar la deuda. para saber esto uli, pedí antes solencia al regato de indees, y","recuperar la deuda. para saber esto último, pedir antes solvencia al registro de índices. y"
3277,77,93,22,"además, slempro se oxgá, enla mece delo post, acuerdos que resuen la sación a","además, siempre se exigirá, en la medida de lo posible, acuerdos que resuelvan la situación a"
3278,9,12,4,cono pazo,corto plazo.
3279,91,96,14,3. dar por venci la operación pera ejecutar a solvencia y llevas l cient a jucio es en esto,dar por vencida la operación para ejecutar la solvencia y llevar al cliente a juicio. es en este
3280,58,63,5,momento cuando pasamos el expedente la ase de recuperación,momento cuando pasamos el expediente a la fase de recuperación.
3281,78,87,12,una vez trenscurridos 90 das el departamento decido si aspasa a contencioso 0.,una vez transcurridos 90 días el departamento decide si lo traspasa a contencioso o no.
3282,93,105,14,a par de ate momento a gestión es dra por cada gestor de departamento. será dl quen negocie y,a partir de este momento la gestión es dirigida por cada gestor del departamento. será él quien negocie y
3283,23,32,10,cda as acuscones a segu,decida las actuaciones a seguir.
3284,97,101,4,"los gestores son los mismos para el seguimiento y a recuperación, per cuando una operación ena en","los gestores son los mismos para el seguimiento y la recuperación, pero cuando una operación entra en"
3285,75,78,5,contencioso es el responsable del departamento quién se arcarga dela gstón.,contencioso es el responsable del departamento quién se encarga de la gestión.
3286,20,24,6,cajarural de teruel.,4.  caja rural de teruel
3287,28,28,0,canales de comercialización:,canales de comercialización:
3288,96,106,11,"el inicio de la gesón viene dada or los distintos canales de disrbución: red de ofnas,jetaura de","el inicio de la gestión viene dada por los distintos canales de distribución: red de oficinas, jefatura de"
3289,23,24,1,"zonas, comerciales, et.","zonas, comerciales, etc."
3290,30,107,77,antes de a admisión a esudo de,"antes de la admisión a estudio de la operación, se realiza un análisis previo sobre si se cumplen una serie"
3291,27,28,1,e condiciones establecidas:,de condiciones establecidas:
3292,64,37,48,"operación, se realza un anális previo obres se cumplen una serio",examen de la documentación presentada
3293,34,35,26,examen dela ocumentacón presentada,análisis del cliente y su actividad
3294,30,0,30,análisis dl cient y su actidad,
3295,24,24,0,análisis de la operación,análisis de la operación
3296,24,25,1,análisis delas garantías,análisis de las garantías
3297,30,45,17,uanicación el esgo gabe delle.,cuantificación del riesgo global del cliente.
3298,12,36,24,admisión yar,admisión y análisis de la operación:
3299,19,108,90,sis dela operación:,realizado el análisis previo por parte de los distintos canales y determinado si la operación está dentro de
3300,95,106,82,fealzado el anális previo por parte de os sos canales y determinado sa operación está dentro de,"las atribuciones del director de la oficina o debe ser elevada al área de riesgos, se realiza la propuesta"
3301,90,16,81,"las aruconss de dect ds la ocn o debe ser elevada al área d fesgos, se resiza la propuesta",correspondiente.
3302,13,106,94,comespondinte,"si el expediente es remitido al área de riesgos, se realiza el estudio e informe correspondiente por parte"
3303,91,50,70,"sl al expesente es emitido al área de rasgos, realza l estudio informo onespondintepor pare","de los analistas, elevando la operación a sanción."
3304,48,0,48,"elos analistas, elevando la operación a sanción.",
3305,19,19,0,órganos de sanción:,órganos de sanción:
3306,83,90,8,"comisión área de resgos: fumada por director de resgos,subdectr de riesgos, jefe de","comisión área de riesgos: formada por director de riesgos, subdirector de riesgos, jefe de"
3307,79,88,12,"recuperaciones y aalstas.los tres primeras, de foma mancomunada, lenan abucones","recuperaciones y analistas. los tres primeros, de forma mancomunada, tienen atribuciones"
3308,84,75,24,para sansonar operaciones hasta 200.000 . con garantia persona y 40.000 con garantia,sara sancionar oseraciones hasta  ¼ con jarantta sersonal \  ¼ con garantía
3309,84,72,31,"iipotecaña, de forma indvidual, 100.000. con gerania personal y 200.000 con garantia",hisotecaria 'e forma individual  ¼ con jarantta sersonal \  con jarantta
3310,7,12,6,potasa.,hipotecaria.
3311,83,90,7,"comisión resgos: formada por dectr general, rector de negocio, drector de riesgos y","comisión riesgos: formada por director general, director de negocio, director de riesgos y"
3312,79,76,16,"subdreior de resgos, con atsbuciones para sancionar operaciones hasta 1.000.000","subdirector de riesgos, con atribuciones para sancionar oseraciones hasta  ¼"
3313,79,31,63,consejo reir: para operaciones superiores a 1.0000. no obstante al consejo e le,cualquiera que sea su garantía.
3314,55,77,52,infowna de todas las operaciones que superan ls 690.000,consejo rector: 3ara oseraciones suseriores a  ¼ no obstante al consejo se le
3315,98,51,71,"los impares indicados en les astiss comisiones, se refieren a iesgo global el clemte,cusquiera que",informa de todas las oseraciones tue suseran los  ¼
3316,36,107,83,sea elimpone dela operación elevada.,"los importes indicados en las distintas comisiones, se refieren a riesgo global del cliente, cualquiera que"
3317,0,39,39,,sea el importe de la operación elevada.
3318,25,25,0,herramientas de análisis:,herramientas de análisis:
3319,84,94,15,"seoing: modelo estaisico para estmar le probabadad de impago de un clone, pariular o","scoring: modelo estadístico para estimar la probabilidad de impago de un cliente, particular o"
3320,35,44,10,"microempresa, a pat de cenas vrales","microempresa, a partir de ciertas variables:"
3321,82,90,12,"vatables microempresas: ipo de producto, fnaidad, garamia. cra de negocio, recusos","variables microempresas: tipo de producto, finalidad, garantía, cifra de negocio, recursos"
3322,42,47,7,"propios, impores excedido, descubiens, sc.","propios, importes excedidos, descubiertos, etc."
3323,82,90,11,"variables parsulres hipotecas: ltv, plazo, fnalds, ingresos. número de hjos, sados","variables particulares hipotecas: ltv, plazo, finalidad, ingresos, número de hijos, saldos"
3324,38,41,6,"mesos de pasivo, indicador de mora, se","medios de pasivo, indicador de mora, etc."
3325,84,93,13,"vatablos paricuars consumo: producto, plazo, fnaldad, ingresos, estado cv, capaciónd","variables particulares consumo: producto, plazo, finalidad, ingresos, estado civil, capacidad"
3326,29,35,7,"de pago, sido medos acvo, et.","de pago, saldos medios activo, etc."
3327,87,95,8,gestón electónica documental (ged): herramienta que falta el archivo y mejora el cont y,gestión electrónica documental (ged): herramienta que facilita el archivo y mejora el control y
3328,62,75,15,"seguimiento delcrcuto de tamiacin, minimizando elsa cperaciona","seguimiento del circuito de tramitación, minimizando el riesgo operacional."
3329,91,38,73,"las operaciones con garanta nipotecaa, también son analizadas juíócamene, no considerándose",formalización operaciones hipotecarias
3330,96,97,79,"soravades asta que no sean viste juracamente, en caso de aprobación la preparación de la minuta.","las operaciones con garantía hipotecaria, también son analizadas jurídicamente, no considerándose"
3331,94,102,78,lea vinculante y documentación necesaria se realza en tenscos centrls para ss alado a notaría.,"aprobadas hasta que no sean viables jurídicamente. en caso de aprobación, la preparación de la minuta,"
3332,60,105,81,se hace especial seguimiento la iquidción inserción en legs.,oferta vinculante y documentación necesaria se realiza en servicios centrales para su traslado a notaría.
3333,0,75,75,,se hace especial seguimiento a la liquidación e inscripción en el registro.
3334,11,11,0,seguimiento,seguimiento
3335,53,61,8,incio del seguimiento en base la siguente estructura:,1.- inicio del seguimiento en base a la siguiente estructura:
3336,23,28,8,pameamiento de cbjetwos,- planteamiento de objetivos
3337,61,65,5,mantenimiento de a decumentaión necesaria para el seguimiento,- mantenimiento de la documentación necesaria para el seguimiento
3338,35,40,6,fealzacón de contrles y seguimiento,- realización de controles y seguimiento
3339,28,32,5,detección de señales de slra,- detección de señales de alerta
3340,22,26,4,evaluación y dagnóstco,- evaluación y diagnóstico
3341,16,18,2,toma de decisión,- toma de decisión
3342,90,98,10,este esquema se complementa conlareszacón de informes y estucos de os resultados obtenidos,este esquema se complementa con la realización de informes y estudios de los resultados obtenidos.
3343,93,101,12,"fay actuidades d seguimiento en tuncón de 3 se tata de patcuares o empresas, para operaciones","hay actividades de seguimiento en función de si se trata de particulares o empresas, para operaciones"
3344,44,50,8,"concretas, en función del estao del deuda ao","concretas, en función del estado de la deuda, etc."
3345,32,32,2,2. establecimiento de objetivos.,2.- establecimiento de objetivos
3346,59,92,34,ojeos telacnados con la inversión creia como paso previo pa,objetivos relacionados con la inversión crediticia como paso previo para el seguimiento y la
3347,25,26,3,«consecución dels mismos:,consecución de los mismos:
3348,19,23,20,al seguimiento y la,estructura de inversión
3349,21,37,29,estructura e inveraón,diversificación por líneas de negocio
3350,33,37,16,diverscacón por líneas de negocio,diversificación por zonas geográficas
3351,31,40,19,diverscacón por zonas geográcas,diversificación por sectores productivos
3352,34,49,24,diverscacón por sectores productos,diversificación por riesgo directo del acreditado
3353,41,19,31,diversteación por esgo dicto del acrctado,ratio de morosidad.
3354,17,51,41,"ato de morosidad,",3.- comunicación de objetivos a la red de oficinas.
3355,49,37,33,3- comunicación de objetivos ala red de oficinas.,4.- documentación para el seguimiento
3356,36,102,78,a. documentación para el seguimiento,la oficina correspondiente solicitará a los clientes objetos de seguimiento la documentación necesaria
3357,84,97,77,la ona coespondent sotrá os cientes objetos de seguimiento la documentación ncesaría,"para la actualización de la información, que complementará a la obtenida a través de los sistemas"
3358,90,102,82,"para la actusización de la inormacin, que complementará la obtenida através delos sitemas.","informáticos y bases de datos externas (equifax, cirbe, informa, etc.). y que variará en función de si"
3359,89,40,71,"inlomátcos y bases de dto estemas [equias, ciase, inoms, ee). y que variará en tuncn de 5",se trata de un particular o una empresa.
3360,34,58,42,so ata de un patear o una empresa.,entre otras deberá solicitarse la siguiente documentación:
3361,52,0,52,ente ovas deberá solctars a siguiente documentación:,
3362,38,38,0,declaraciones de la renta actualizadas,declaraciones de la renta actualizadas
3363,13,13,0,notas simples,notas simples
3364,7,7,1,néminas,nóminas
3365,25,4,23,5- seguimiento del riesgo,etc.
3366,89,26,73,en inaas generales cualquer vación de datos signiatvos y cambos en ls inerúnientes deberá,5.- seguimiento del riesgo
3367,88,102,79,"comunicarso de inmedato sn esperar al seguimiento periódico, comunicándose por escrto al",en líneas generales cualquier variación de datos significativos y cambios en los intervinientes deberá
3368,47,91,70,“paramento de resgos ya e de 2002 corespondint.,"comunicarse de inmediato sin esperar al seguimiento periódico, comunicándose por escrito al"
3369,13,58,50,tación labora,departamento de riesgos y al jefe de zona correspondiente.
3370,41,16,32,fetacón empresa donde preste los senicios,relación laboral
3371,12,43,34,tuación tata,relación empresa donde presta los servicios
3372,30,18,24,posta vent de bienes inmusoles,situación familiar
3373,39,33,29,"""osticacines ena relacón con la entidad",posible venta de bienes inmuebles
3374,34,44,34,6. seguimiento del riesgo impagado,modificaciones en la relación con la entidad
3375,90,35,70,"el aros de recuperaciones, perteneciente l deparamento de lsgos reaizará la revisión e los",6.- seguimiento del riesgo impagado
3376,85,96,69,impagados o excedios de la entáad. y unto con ls jottuas de 2003 realzar las gostones,"el área de recuperaciones, perteneciente al departamento de riesgos realizará la revisión de los"
3377,49,95,70,«omezpondientes encaminadas a recuperar la deuda.,impagados o excedidos de la entidad. y junto con las jefaturas de zona realizarán las gestiones
3378,15,50,41,becuperaciones.,correspondientes encaminadas a recuperar la deuda.
3379,92,15,80,1 semanalmente en el deparamento de esgos e saca un istado de préstamos en situació negular.,recuperaciones.
3380,68,102,75,"además, al slctr el cado inventao puede hacer la siguiente petición:",1.- semanalmente en el departamento de riesgos se saca un listado de préstamos en situación irregular.
3381,42,76,57,solo suaciones impegacas (menos de 9 días),"además, al solicitar el citado inventario puede hacer la siguiente petición:"
3382,0,46,46,,solo situaciones impagadas (menos de 90 días).
3383,54,54,0,solo dudosos (más 90 días y menos 36 meses o manuales),solo dudosos (más 90 días y menos 36 meses o manuales)
3384,46,52,9,muy coso cobro y aldo (más 96 meses 0 manuals),muy dudoso cobro y fallido (más 36 meses o manuales)
3385,19,22,4,todos los ineguares,todos los irregulares.
3386,38,42,5,"todos menos de muy dudoso cobro y aid,",todos menos de muy dudoso cobro y fallido.
3387,89,105,16,2. con l inventario de préstamos lama a cada una delas ofcnas que tenen stuacons ireguars,2.- con el inventario de préstamos se llama a cada una de las oficinas que tienen situaciones irregulares
3388,95,100,6,para averiguar por qué se ha producido la siación regular en cade uno de los caos y qué se está,para averiguar por qué se ha producido la situación irregular en cada uno de los casos y qué se está
3389,80,87,7,haciendo pra el ecoro. se ls indican además que deben segu ls siguientes pautas:,haciendo para el recobro. se les indican además que deben seguir las siguientes pautas:
3390,54,67,13,llamar a cet informándole de a suación que e ha proud.,llamar al cliente informándole de la situación que se ha producido.
3391,70,81,13,"intento dai de cargo, pra lo cual s deben segui as squentes praidades:","intento diario de cargo, para lo cual se deben seguir las siguientes prioridades:"
3392,27,29,8,+ reguarzarlos descublerios,regularizar los descubiertos.
3393,43,48,9,+ regularzar uidaciones deudoras del cuenta,regularizar liquidaciones deudoras de la cuenta.
3394,41,45,8,= reguarzar spuestos impagados de tartas.,regularizar dispuestos impagados de tarjetas.
3395,30,32,6,+ reguarzarrecbos de préstamo.,regularizar recibos de préstamo.
3396,79,84,7,"además de segui as preerencias inacadas, las mismas se reslzarán dentro de cada","además de seguir las preferencias indicadas, las mismas se realizarán dentro de cada"
3397,19,22,4,"punto, por anigedas","punto, por antigüedad."
3398,79,82,6,intomarán a los responsables del depariamento de fesgosárea de recuperaciones y,informarán a los responsables del departamento de riesgos-área de recuperaciones y
3399,82,91,11,"morosidad delas gastanes realizadas y resutados, mediante coreo elecrnico que será","morosidad de las gestiones realizadas y resultados, mediante correo electrónico que servirá"
3400,32,38,12,se licme. este loma será semanal,de informe. este informe será semanal.
3401,85,104,21,3. al mes del prer conato con la fa y siguendo la suación regla del cierto se vuele a,3.- al mes del primer contacto con la oficina y siguiendo la situación irregular del cliente se vuelve a
3402,91,100,13,preguntar l responsable de la ocn sobre la siuacón y por qué edavia no ss ha procedido 4 la,preguntar al responsable de la oficina sobre la situación; y por qué todavía no se ha procedido a la
