n_linea,ctexto1,ctexto2,distancia,texto1,texto2
4678,87,65,60,sociedad gestora y dexdament justfcados incluyendo la comssón de administración a favor,d) gastos extraordinarios de auditorías y de asesoramiento legal.
4679,87,102,70,"de ésta. y el teto de gatos y comisnes por servo, inlucios los derivados del contato de","e) si fuera el caso, el importe remanente de gastos iniciales de constitución del fondo y de emisión y"
4680,81,92,63,agencia de pagos y a comisión pedia a pega la entidad depostar. en este orden slo,admisión de los bonos que hubiera excedido del principal del préstamo para gastos iniciales.
4681,93,99,74,se atenderán on favor delos administradores y en relación con el contrato de administració os,"en general, cualesquiera otros gastos requeridos extraordinarios o no determinados entre los gastos"
4682,78,102,67,gastos que hubieren emicpado o supido por cuenta del fondo y las canidades que,ordinarios que fueran soportados por el fondo o por la sociedad gestora en representación y por cuenta
4683,86,10,78,"conespondera devoweris en relación cón ls préstamos hpotecarios, idos ello debidamente",del mismo.
4684,85,68,68,justfcados y la comisión pora sdminisraión de los préstamos hpotecares sol 6 el ao de,3.4.6.2.2 fondos disponibles para amortización: origen y aplicación.
4685,85,10,79,que tura luar la suttción del administrador pr un nuevo administrador distro de banco,1. origen.
4686,0,95,95,,los fondos disponibles para amortización en cada fecha de pago serán el importe de la retención
4687,0,100,100,,para amortización efectivamente aplicado de los fondos disponibles en el quinto (5º) lugar del orden
4688,0,50,50,,de aplicación en la fecha de pago correspondiente.
4689,0,60,60,,2. distribución de los fondos disponibles para amortización.
4690,0,94,94,,los fondos disponibles para amortización se aplicarán en cada fecha de pago secuencialmente en
4691,0,95,95,,primer lugar a la amortización de los bonos hasta su total amortización y en segundo lugar a la
4692,0,28,28,,amortización del préstamo b.
4693,0,53,53,,orden de prelación de pagos de liquidación del fondo.
4694,0,98,98,,la sociedad gestora procederá a la liquidación del fondo en la fecha de vencimiento final o cuando
4695,0,100,100,,tuviera lugar la liquidación anticipada con arreglo a lo previsto en los apartados 4.4.3 y 4.4.4 del
4696,0,100,100,,"documento de registro, mediante la aplicación de los fondos disponibles por los siguientes conceptos"
4697,0,98,98,,"los “fondos disponibles de liquidación” i de los )ondos 'issonibles, (ii) de los importes que vaya"
4698,0,99,99,,obteniendo el fondo por la enajenación de las participaciones hipotecarias y de los certificados de
4699,0,103,103,,"transmisión de hipoteca y de los activos que quedaran remanentes, y (iii) adicionalmente y, en su caso,"
4700,0,101,101,,"el préstamo, con arreglo a lo previsto en el apartado 4.4.3.3.(iii) del documento de registro, que se"
4701,0,102,102,,"destinarán íntegramente a la amortización anticipada de bonos pendientes de reembolso, en el siguiente"
4702,0,75,75,,orden de srelación de sajos el “orden de prelación de pagos de liquidación”
4703,0,99,99,,"1º.  reserva para hacer frente a los gastos finales de extinción y liquidación de orden tributario,"
4704,0,30,30,,administrativo o publicitario.
4705,0,96,96,,"2º.  pago de los impuestos y gastos ordinarios y extraordinarios del fondo, suplidos o no por la"
4706,0,93,93,,"sociedad gestora y debidamente justificados, incluyendo la comisión de administración a favor"
4707,0,97,97,,"de ésta, y el resto de gastos y comisiones por servicios, incluidos los derivados del contrato de"
4708,0,93,93,,agencia de pagos y la comisión periódica a pagar a la entidad depositaria. en este orden sólo
4709,0,96,96,,se atenderán en favor de los administradores y en relación con el contrato de administración los
4710,0,82,82,,gastos que hubieren anticipado o suplido por cuenta del fondo y las cantidades que
4711,0,94,94,,"correspondiera devolverles en relación con los préstamos hipotecarios, todos ellos debidamente"
4712,0,97,97,,justificados y la comisión por la administración de los préstamos hipotecarios solo en el caso de
4713,0,95,95,,que tuviera lugar la sustitución del administrador por un nuevo administrador distinto de banco
4714,12,12,0,cooperativo.,cooperativo.
4715,47,51,7,3%. pago delos intereses devengados de os soros,3º.  pago de los intereses devengados de los bonos.
4716,38,3,36,4%. amorización del púncpal els bonos.,4º.
4717,80,40,62,5%. encaco de que tura concerado un préstamo con argo al reviso en lapaado 4.43.,amortización del principal de los bonos.
4718,81,103,79,"del documento de regis, pago de los gastos nancers devengados y del feembalso del",5º.  en caso de que fuera concertado un préstamo con arreglo a lo previsto en el apartado 4.4.3.3.(iii)
4719,28,88,72,prncal el préstemo concerado,"del documento de registro, pago de los gastos financieros devengados y del reembolso del"
4720,50,34,36,8%. pago delos interesos devengados del prástamo e,principal del préstamo concertado.
4721,39,3,38,7%. amorización del púncpal el préstamo,6º.
4722,74,48,31,8. pago delos interesos devengados del prásiamo suberdnado para intereses.,pago de los intereses devengados del préstamo b.
4723,64,3,63,9%. amonización del púncpal el préstamo suscrnado para intereses,7º.
4724,64,42,44,10%. pago de intereses devengados del préstamo para gastos nice.,amortización del principal del préstamo b.
4725,61,3,60,11 reembolso del píncipal del préstamo para gastos iniciales.,8º.
4726,68,73,17,12. pago delos intereses devengados del préstamo subordnado princpal,pago de los intereses devengados del préstamo subordinado para intereses.
4727,59,3,58,13. amonizacón del principal dl préstamo subordnado prncpa.,9º.
4728,92,67,70,"14. pago alos administradores en relación con l contrato de acministacó, de a comisión or la",amortización del principal del préstamo subordinado para intereses.
4729,39,69,47,atminitración dels préstamos hpotecaros,10º. pago de intereses devengados del préstamo para gastos iniciales.
4730,91,65,68,en el cas de que tuviera lugar la sustución en su actvidad como administrador de cualquiera,11º.  reembolso del principal del préstamo para gastos iniciales.
4731,86,73,65,"dels administadors, en tavor de ova entidas, pago dela comisión de administración elos",12º. pago de los intereses devengados del préstamo subordinado principal.
4732,88,67,64,"préstamos hipotecarios, que se devengará favor deltecero, nuevo administrador, ocupará 6",13º. amortización del principal del préstamo subordinado principal.
4733,88,101,77,"lugar contenido en el orden 2> anterior, juno con os restantes pagos incucos 6n el orden","14º.  pago a los administradores en relación con el contrato de administración, de la comisión por la"
4734,78,45,60,"cortespondiente, salvo en el supuesto de que el nuevo admastrados fuese banco,",administración de los préstamos hipotecarios.
4735,77,95,69,"cooperativo, en cuyo caso el pago dela comisión de adminisacón se manten en 0",en el caso de que tuviera lugar la sustitución en su actividad como administrador de cualquiera
4736,15,97,86,mismo orden 14%,"de los administradores, en favor de otra entidad, el pago de la comisión de administración de los"
4737,47,93,73,151. pago del margen de insrmedición financiera,"préstamos hipotecarios, que se devengará a favor del tercero, nuevo administrador, ocupará el"
4738,88,92,69,cuando en un mismo número de orden de prelación existan cantidades exigibles por derntes,"lugar contenido en el orden 2° anterior, junto con los restantes pagos incluidos en el orden"
4739,85,79,64,concepts en la fecha de vencmieno final o cuendo dera lugar la lqudecón antpada y los,"correspondiente, salvo en el supuesto de que el nuevo administrador fuese banco"
4740,90,85,75,fondos dsponbes de liquciación no fueran sutcints par atender ls importes oxigils de tados,"cooperativo, en cuyo caso el pago de la comisión de administración se mantendrá en el"
4741,89,16,79,"ellos, a apcación del remanente delos foros disponbles de liquidación se realzar prorrata",mismo orden 14º.
4742,92,51,68,"entre os importes que sean exigible decada uno deals, procediéndose al detbución del importe",15º.  pago del margen de intermediación financiera.
4743,68,91,63,picado a cada concepto por l orden de vencmiento de os débtos sxgbes,cuando en un mismo número de orden de prelación existan cantidades exigibles por diferentes
4744,36,97,76,"margen de intermediación financiera,",conceptos en la fecha de vencimiento final o cuando tuviera lugar la liquidación anticipada y los
4745,0,100,100,,fondos disponibles de liquidación no fueran suficientes para atender los importes exigibles de todos
4746,0,99,99,,"ellos, la aplicación del remanente de los fondos disponibles de liquidación se realizará a prorrata"
4747,0,103,103,,"entre los importes que sean exigibles de cada uno de ellos, procediéndose a la distribución del importe"
4748,0,78,78,,aplicado a cada concepto por el orden de vencimiento de los débitos exigibles.
4749,0,36,36,,margen de intermediación financiera.
4750,92,92,0,"la sociedad gestora, en representación y por cuenta del fondo, celebrará con bantierra, caja","la sociedad gestora, en representación y por cuenta del fondo, celebrará con bantierra, caja"
4751,78,78,0,"rural de granada, caja rural de navarra y caja rural de teruel, un contrato de","rural de granada, caja rural de navarra y caja rural de teruel, un contrato de"
4752,83,90,11,intermedación fnancca desinado a remunerar a las enidadas cedemes pol el proceso de,intermediación financiera destinado a remunerar a las entidades cedentes por el proceso de
4753,87,104,21,intemediación inancera desarolado y que ha perrido la trnstormación anancera deter dela,intermediación financiera desarrollado y que ha permitido la transformación financiera definitoria de la
4754,85,105,25,"ctvead del fondo, la suscrpaln por ése delas paicpacones polacas y delos cericados de","actividad del fondo, la suscripción por éste de las participaciones hipotecarias y de los certificados de"
4755,60,67,7,transmisión de hpoteca y las calicacones asignadas os bonos.,transmisión de hipoteca y las calificaciones asignadas a los bonos.
4756,89,99,13,las entidades cecents tendrán derecho a pers delfando una remuneración vara y subordinada,las entidades cedentes tendrán derecho a percibir del fondo una remuneración variable y subordinada
4757,89,94,14,(el margen de intermediación financiera) que se determinar y devengar a vencmiomo de ceda,el “margen de intermediación financiera” tue se determinari \ devenjari al vencimiento de cada
4758,92,105,14,"periodo timesta, comprensivo excepto para el primer peñodo, dels es meses naturales antros a","periodo trimestral, comprensivo, excepto para el primer periodo, de los tres meses naturales anteriores a"
4759,82,102,32,"fecna de pago, an una cuanta quel a 8 dletenol posta, lla pubere, ent los ngasos y","cada fecha de pago, en una cuantía igual a la diferencia positiva, si la hubiere, entre los ingresos y"
4760,95,98,4,"gastos incluidas las pércidas de ejecicos anteriores, devengados por el fondo de acuerdo con su","gastos, incluidas las pérdidas de ejercicios anteriores, devengados por el fondo de acuerdo con su"
4761,93,105,15,"contalidad y previos lcioe de os meses ds marzo, jn, septembre y diciembre que coresporden al","contabilidad y previos al cierre de los meses de marzo, junio, septiembre y diciembre que corresponden al"
4762,95,101,11,"último mes de cada perado timesralexcepcionsimene, el primer periodo comprenderá desde a fecha.","último mes de cada periodo trimestral. excepcionalmente, el primer periodo comprenderá desde la fecha"
4763,3,104,101,sos,"de constitución del fondo hasta el 30 de septiembre de 2014, incluido, que corresponde al último día del"
4764,90,102,73,"e constución dl fondo hast el 0 de segiembre de 2014, inudo, que conesponde al simo dla dl","mes anterior a la primera fecha de pago, 14 de octubre de 2014. el margen de intermediación financiera"
4765,93,96,71,"mos ateo ala prmera fecha de pago, 14 de octubre de 2014. el margen de inermediación fnancira",se devengará a favor de cada entidad cedente conforme a las reglas de imputación previstas en el
4766,90,38,70,se devengará 2 favor de cada entgad cedente conlome las reglas de imputacón previstas an 6,contrato de intermediación financiera.
4767,32,98,72,contrato de itemeciación finance,la liquidación del margen de intermediación financiera que hubiere sido devengado al cierre de los
4768,90,93,76,la iquicación del margen de inermedación financiera que ubler sido devengado al dere e los,"meses de marzo, junio, septiembre y diciembre se realizará en la fecha de pago inmediatamente"
4769,90,98,76,"meses de marzo, juro, sepiembre y diciembre se reglzará en la fecha de pago inmediatamente",posterior al último día de cada uno de los citados meses siempre que el fondo disponga de liquidez
4770,87,104,74,poster al úlima día de cada uno delos adas meses siempre que 6l fondo deponga de iqudez,"suficiente de acuerdo con el orden de prelación de pagos o, en la liquidación del fondo, con el orden de"
4771,92,34,62,"suftieme e acuerdo con el orden de presión de pagos , enla liquidación del fondo. co e on de",prelación de pagos de liquidación.
4772,32,95,71,prlación de pagos de liquidación,"en caso de que el fondo, conforme al orden de prelación de pagos, no dispusiera en una fecha de"
4773,90,100,72,"en caso de que el fondo, conforme al oran de prelcón de pagos, no depusera en una fecha de","pago de liquidez suficiente para satisfacer la totalidad del margen de intermediación financiera, el"
4774,91,90,69,"pago de laudez sutctenis para satafacer la fotldad del nzgen de intermedacón financiera, el",importe del margen de intermediación financiera devengado que hubiera quedado sin pagar se
4775,85,97,63,impor del margen ge inemedición financiera devengado que hublore quedado sin pager se,acumulará sin penalidad alguna al margen de intermediación financiera que corresponda pagar en la
4776,93,45,71,cumulrá sin pensided alguna al margen de intermediación financera que contesponda pagar en la,"siguiente fecha de pago, hasta su pago total."
4777,41,100,79,"siguente fecha de pago, hasta su pago toa",el contrato de intermediación financiera quedará resuelto de pleno derecho en el caso de que (a) las
4778,97,100,74,el contrato de intermediación financiera quedar resueto de pleno derecho en l caso de que (a) las,"agencias de calificación no confirme antes de las 13:00 horas (hora cet) del día 4 de julio de 2014,"
4779,90,106,74,"agencias de calfcacón no conlime antes de las 130 horas hora cet) del da 4 dejalo de 2014,","como finales, las calificaciones asignadas con carácter provisional a bonos o (b) de que no se produzca el"
4780,95,50,71,como nales ls calfcacones asignadas con carte provisional a bonos o (9) de queno se prosuzca el,desembolso de la totalidad de la emisión de bonos.
4781,43,91,64,esembolo de la oeldad e a emisión de bonos.,otros acuerdos de los que dependen los pagos de intereses y del principal a los inversores.
4782,86,39,61,tos acuerdos delos que dependen los pagos de intereses y del principal alos inversores,agente de pagos de la emisión de bonos.
4783,31,100,79,agente de pagos dela emisión de,"el servicio financiero de la emisión de bonos se atenderá a través de barclays, en calidad de agente"
4784,93,97,76,"el senicio financiero dela emisión de bonos ss atenderá través de barclays, en cala de agente",de pagos. el pago de intereses y amortizaciones se comunicará a los titulares de los bonos en los
4785,89,95,71,de pagos. el pago de intereses y amorizacones se comunicará a os taras delos bonos en los,supuestos y con los días de antelación previstos para cada caso en el apartado 4.1.1 del módulo
4786,91,108,81,supuestos y con os días de antelación previsos para cada caso en ol aparado 4.11 del módulo,adicional. el abono de intereses y de las amortizaciones será realizado a los titulares de los bonos por las
4787,84,109,81,adcona. el abono d inereses yd ls amorizacones ser eglzado lo aos de os bonos po las,"entidades participantes en iberclear correspondientes y, a éstas, a su vez, les será realizado por iberclear,"
4788,90,87,65,"nicades partepantes en bercaarcorespondantes y, étas, a su vez, les será relzado po ivrea.",como entidad encargada del registro contable de las anotaciones en cuenta de los bonos.
4789,81,0,81,omo anida encargada del registro contabi de as anotaciones en cuenta de los bonos,
4790,94,94,0,"la sociedad gestora, en representación y por cuenta del fondo, celebrará con barclays y con la","la sociedad gestora, en representación y por cuenta del fondo, celebrará con barclays y con la"
4791,84,92,11,«comparecencia de banco cooperativo un contro de agencia de pagos para reszar l seco,comparecencia de banco cooperativo un contrato de agencia de pagos para realizar el servicio
4792,88,93,16,"narco de la emisión de bonos que se emten ton cargo el fondo (el ""contrato de agencia de",financiero de la (misión de %onos tue se emiten con carjo al )ondo el “contrato de agencia de
4793,5,6,1,pagos,pagos”
4794,94,93,7,"las obigaciones que asumirá barolays (cl ""agente de pagos!) en el contrato de agencia de pagos",las obligaciones que asumirá barclays el “agente de pagos” en el contrato de agencia de pagos
4795,29,33,4,son resumidamente as sguentes,son resumidamente las siguientes:
4796,91,3,89,"(0 encada una delas fechas de pago de os oros, efectuar el pago de inreses y, an u caso, de",(i)
4797,86,95,72,"resmboko dl prnipal delos bonos através de arce, una vez deducdo sl impone total de la","en cada una de las fechas de pago de los bonos, efectuar el pago de intereses y, en su caso, de"
4798,93,99,76,"retención a cuenta por rendimientos del caplal mobtiaño ue deba electr la socedad gestora, en","reembolso del principal de los bonos a través de iberclear, una vez deducido el importe total de la"
4799,64,100,71,"representación del fondo, de acuerdo con le legiieció cal acabe,","retención a cuenta por rendimientos del capital mobiliario que deba efectuar la sociedad gestora, en"
4800,90,73,64,de inter de aetaencia determinado que serdra de vaso para el csclo por la sociedad gestora,"representación del fondo, de acuerdo con la legislación fiscal aplicable."
4801,43,4,41,del tio de itrés nominal aicabl alos bonos.,(ii)
4802,97,98,73,"en el supuesto de que la deuda no sudoránada y no garantizada dl agente de pagos expermentara, en","en cada una de las fechas de fijación del tipo de interés, comunicar a la sociedad gestora el tipo"
4803,90,96,71,"uakuler momento del ida de la emisión de bonos, un descenso en la casación de dbas a laigo",de interés de referencia determinado que servirá de base para el cálculo por la sociedad gestora
4804,88,50,64,piezo por debajo de bbb (hgn) o un descenso de la caliacón cesta a cono 0 lago plazo par,del tipo de interés nominal aplicable a los bonos.
4805,97,100,78,"debajo de f3 o de bra. respectivamente, según la escala de calicación de fih, la socedas gestora,","en el supuesto de que la deuda no subordinada y no garantizada del agente de pagos experimentara, en"
4806,88,99,73,“nun plazo máximo de testa (30) das nauraes a contr desde el momento qu tenga lugar dera,"cualquier momento de la vida de la emisión de bonos, un descenso en la calificación de dbrs a largo"
4807,79,102,78,"ercunstancia, deberá poner en práctca alguna de las opcanes desrtas a contación",plazo por debajo de bbb (high) o un descenso de la calificación crediticia a corto o a largo plazo por
4808,88,103,79,(0 obtener de una entóad cuya no subordinada y no garantizada tenga una cacacón de das a,"debajo de f3 o de bbb-, respectivamente, según la escala de calificación de fitch, la sociedad gestora,"
4809,83,97,65,"largo plazo minima de bb high) (a que dcha calcacón se enuenve en siación de ""under",en un plazo máximo de treinta (30) días naturales a contar desde el momento que tenga lugar dicha
4810,80,88,72,reriew (negate)) yo una calcacón credtcia minima coo ya lago pazo de f y de bos.,"circunstancia, deberá poner en práctica alguna de las opciones descritas a continuación:"
4811,85,3,84,"respectvamente, según la escala de caicación de flch, un aval inconcional, suceso y a",(i)
4812,91,92,73,"prmer requerimiento que gerente el pego al fondo, a sima solista de la socedad gestora, los",obtener de una entidad cuya no subordinada y no garantizada tenga una calificación de dbrs a
4813,88,95,73,compromisos asumidos porel agent de pagos durante el tempo que se mantenga la stuacón de,largo plazo mínima de bbb (high) sin tue dicha calificación se encuentre en situación de “8nder
4814,77,95,68,péreida dela alficación 88 (hon) yl f3 y 888. por pare del agente de pagos. 0,"5eview 1ejative” \o una calificación crediticia mínima a corto y a largo plazo de f3 y de bbb-,"
4815,91,97,76,"(1) resocar la designación del agente de pagos, procediendo a designar a ara onidad cuya no","respectivamente, según la escala de calificación de fitch, un aval incondicional, irrevocable y a"
4816,88,99,76,subordinada y no garantizada tanga na calficacón de dbrs a lago plazo mínima de bb8 (gh),"primer requerimiento que garantice el pago al fondo, a simple solicitud de la sociedad gestora, los"
4817,88,93,72,(sin que denacalcacón se encuentre en suación de “under review (negatve]) y una cafcacón,compromisos asumidos por el agente de pagos durante el tiempo que se mantenga la situación de
4818,87,86,65,"credtica míima a cono y a laigo plazo de f3 y de bb. respectvamente, según la escala de",pérdida de la calificación bbb (high) y/o f3 y/o bbb- por parte del agente de pagos; o
4819,93,4,91,"calicacón de faen, que l sustiuya antes de dar por resueto el contrato de agencia de pagos, 0",(ii)
4820,91,89,69,"an su caso, an inc un nuevo contato de agencia de pagos, y sujeto ala comunicación previa a","revocar la designación del agente de pagos, procediendo a designar a otra entidad cuya no"
4821,25,94,76,las agencias de calcación,subordinada y no garantizada tenga una calificación de dbrs a largo plazo mínima de bbb (high)
4822,91,98,81,en el supuesto de que el agente de pagos sur una rebaja  etrada n a calcacón de su deus por,sin tue dicha calificación se encuentre en situación de “8nder 5eview 1ejative” \ una calificación
4823,89,94,78,"las agencas de caliacón, e o comunicará ala sociedad gestora. banco cooperativo, desde al","crediticia mínima a corto y a largo plazo de f3 y de bbb-, respectivamente, según la escala de"
4824,92,101,74,momento en que se ds el descenso de la calficacón credicia dl agente de pagos que de lagar a,"calificación de fitch, que le sustituya antes de dar por resuelto el contrato de agencia de pagos, o,"
4825,88,99,76,"adoptar alguns delas opciones 0 (1 amerite, se compromete a realzar esuerzos comerciales","en su caso, en virtud de un nuevo contrato de agencia de pagos, y sujeto a la comunicación previa a"
4826,66,29,52,razonables para que la socadad gestora pueda sdopia alguna de ells,las agencias de calificación.
4827,92,103,75,"todos los costs, gatos e impuestos en que se incuran por la realización y fomalzación de las",en el supuesto de que el agente de pagos sufra una rebaja o retirada en la calificación de su deuda por
4828,56,97,61,"antnores opciones serán por cuenta de banco cooperativo,","las agencias de calificación, se lo comunicará a la sociedad gestora. banco cooperativo, desde el"
4829,93,97,76,"en contraprestación los seco a realzar porel agent de pagos, el fondo l saitará en cada fecha",momento en que se dé el descenso de la calificación crediticia del agente de pagos que dé lugar a
4830,94,100,78,"e pago durante la igenc del contrato, un comisión quese pagará sempre que el fondo disponga de","adoptar alguna de las opciones (i) o (ii) anteriores, se compromete a realizar esfuerzos comerciales"
4831,91,70,68,"ieidez sutciet de acuerdo con el orden de prelaón de pagos , e a egucación dl fondo, con al",razonables para que la sociedad gestora pueda adoptar alguna de ellas.
4832,90,97,75,orden de preación de pagos de liquidación. si barclays fuera susto como agente de pagos la,"todos los costes, gastos e impuestos en que se incurran por la realización y formalización de las"
4833,94,58,72,sociedad gestora estará facuada para medica la comisión en favor de a enidadsusttuta que podrá,anteriores opciones serán por cuenta de banco cooperativo.
4834,39,106,84,"ser super ala establecida con barclays,","en contraprestación a los servicios a realizar por el agente de pagos, el fondo le satisfará en cada fecha"
4835,96,101,75,"en el supuesto ds que el fondo, contarme al orden de prelación de pagos, no dispusiera de kquiez","de pago durante la vigencia del contrato, una comisión que se pagará siempre que el fondo disponga de"
4836,89,104,74,"sutcane para eatitacer la totalidad de la comizón, los impones no pegados se acumueián en","liquidez suficiente de acuerdo con el orden de prelación de pagos o, en la liquidación del fondo, con el"
4837,94,97,76,"penalded alguna ale comisión que coesponda pagar en la siguiente fecha de pago, a o ser que se","orden de prelación de pagos de liquidación. si barclays fuera sustituido como agente de pagos, la"
4838,97,103,85,"mantasra dcha situación de liquidez, en cuyo caso ls importes detidos se irán acumulando hasta su",sociedad gestora estará facultada para modificar la comisión en favor de la entidad sustituta que podrá
