n_linea,ctexto1,ctexto2,distancia,texto1,texto2
1508,88,90,8,devengo de intereses (periodos de devengo de intereses) comprenshvos de los das etecivos,devenjo de intereses “periodos de devengo de intereses” comsrensivos de los dtas efectivos
1509,93,98,9,"""ranscunidos entr cada dos fechas de pago consecuvas, incluyendo en cada panodo de devengo de","transcurridos entre cada dos fechas de pago consecutivas, incluyendo en cada periodo de devengo de"
1510,85,90,6,"intereses la fecha de pago nica, y excluyendo la fecha de pago tna. excepcionalmente:","intereses la fecha de pago inicial, y excluyendo la fecha de pago final. excepcionalmente:"
1511,97,3,95,(0 elprimer periodo de dewengo de intereses tencrá una duración equivalente alos días olcivamante,(i)
1512,85,98,75,"trenscuidos enr la fecha de desemboio, e 8 de jul de 2014, cid, y la primera focha de",el primer periodo de devengo de intereses tendrá una duración equivalente a los días efectivamente
1513,39,98,71,"pago el14decotubre de 2014, excluida: y","transcurridos entre la fecha de desembolso, el 8 de julio de 2014, incluida, y la primera fecha de"
1514,90,42,72,(1) sl útmo pero de devengo de ineresas tendrá una duracón equivalente als ía etectramente,"pago el 14 de octubre de 2014, excluida; y"
1515,91,4,89,"trenscuidos ense la lima fecha de pago previa ala equcación del fondo, icluida. y a ecna de",(ii)
1516,17,98,86,"liquidación, excl",el último periodo de devengo de intereses tendrá una duración equivalente a los días efectivamente
1517,90,102,78,el to de inerés nominal so devengará sobre los dla efecivos tanacuridos de cada periodo de,"transcurridos entre la última fecha de pago previa a la liquidación del fondo, incluida, y la fecha de"
1518,93,22,82,"devengo de ineresos para el que tublere sido determinado, calcuándose sobre la base de un 2%0","liquidación, excluida."
1519,23,97,84,«compuesto por 360 días,el tipo de interés nominal se devengará sobre los días efectivos transcurridos de cada periodo de
1520,23,95,78,"""tipo de interés nomina","devengo de intereses para el que hubiere sido determinado, calculándose sobre la base de un año"
1521,31,23,24,el to de ierés nominal apícable,compuesto por 360 días.
1522,35,24,26,intereses será l qu resul de sumar.,tipo de interés nominal.
1523,55,94,39,los bonos y determinado para cada periodo de devengo de,el tipo de interés nominal aplicable a los bonos y determinado para cada periodo de devengo de
1524,73,39,52,"(0 el tipo interés de aerencia según se establece enel apaado siguente, y",intereses será el que resulte de sumar:
1525,23,3,22,"(0 un margen del 1.50%,",(i)
1526,93,80,65,e ipods ntrés nominal resultante se expresará en anto por cent con rs decimales reondeando la,"el tipo de interés de referencia, según se establece en el apartado siguiente, y"
1527,54,26,43,"tr conespondiente a la milésima, con equdetenia 9 alza","(ii)  un margen del 1,50%."
1528,49,104,69,tipo de interés de reterencia y su determinación.,el tipo de interés nominal resultante se expresará en tanto por ciento con tres decimales redondeando la
1529,98,63,74,el tg0 de interés de referencia (“tipo de interés de relerencia) para la determinación del tipo de,"cifra correspondiente a la milésima, con equidistancia al alza."
1530,49,49,42,interés nominal aplcable lo bonos es el siguiente,tipo de interés de referencia y su determinación.
1531,90,98,75,"1) salvo para el primer peñodo de devengo de ineesos, el 1p0 eurtor “euro imeran otead rat",(l tiso de interés de referencia “tipo de interés de referencia” sara la determinación del 7iso de
1532,81,54,64,scudo y detibudo por el sisema de infomación inancisra saidge por mandato de fee.,interés nominal aplicable a los bonos es el siguiente:
1533,83,102,80,"(feceraion banca de ¡union eutopéenne), res (3) mesas de vencmiento hjado ales 1100","i) 6alvo sara el srimer 3eriodo de 'evenjo de ,ntereses el tiso (uribor “(uro ,nter%ann 2ffered 5ate”,"
1534,88,90,72,"horas dela ma ana (ora cet ""cent european time) dela fecha de fjaión del tipo de interés",calculado y distribuido por el sistema de información financiera bridge por mandato de fbe
1535,81,91,73,"descrta a continuación, y que actuamene se pubica en la página eecuónca euriboro!",“)éderation %ancaire de l¶8nion (uroséenne” a tres  meses de vencimiento fijado a las 11:00
1536,78,95,72,"suminirada por extra, cualquier ora página que pudiera reemplaza en ete serio.","horas de la maxana hora c(7 “central (urosean 7ime” de la )echa de )imación del 7iso de ,nterés"
1537,89,89,73,"excepcionalmente, el tp de inter de aeternca para l pines periodo de devengo de intereses","descrita a continuación, y que actualmente se publica en la página electrónica euribor01,"
1538,87,92,75,sex el que resul dela nterpolacón ins entre el po eurbor a es (3) meses y 8 po esrtor a,"suministrada por reuters, o cualquier otra página que pudiera reemplazarla en este servicio."
1539,88,97,76,"ses (6) meses de vencimiento, tados las 11:00 hras dela mañana (ora cet) del segurdo dia","excepcionalmente, el tipo de interés de referencia para el primer periodo de devengo de intereses"
1540,93,105,78,fabi antenar ala fecha ds desemboiso teniendo en cuenta l número de las del primer periodo de,será el que resulte de la interpolación lineal entre el tipo euribor a tres (3) meses y el tipo euribor a
1541,91,96,72,desengo de intereses. el álul el tpo de interés de reerencia para el primer pero de devengo,"seis (6) meses de vencimiento, fijados a las 11:00 horas de la mañana (hora cet) del segundo día"
1542,56,99,75,de intereses se realizará con eegl ala siguente fórmula:,"hábil anterior a la fecha de desembolso, teniendo en cuenta el número de días del primer periodo de"
1543,40,100,90,ir [(0-90/90) xe6] + [(-a10-20/90))x es],devengo de intereses. el cálculo del tipo de interés de referencia para el primer periodo de devengo
1544,0,61,61,,de intereses se realizará con arreglo a la siguiente fórmula:
1545,0,48,48,,ir = [((d-90)/90) x e6] + [(1-((d-90)/90)) x e3]
1546,6,6,0,donde:,donde:
1547,72,83,16,ia- tios inrés de referencia para el prmer peredo de devengo de ineresas,ir =  tipo de interés de referencia para el primer periodo de devengo de intereses.
1548,56,3,54,d= número de dls del pámor periodo de devengo de inresos,d =
1549,46,58,40,es - tio eurisor els (6) meses de vencimiento.,número de días del primer periodo de devengo de intereses.
1550,42,50,11,es = tio euro a o (3) meses de vencimiento,e6 = tipo euribor a seis (6) meses de vencimiento.
1551,90,50,66,las definiciones relavas el po euribor que fueran aprobadas por la fbe y por la asociación,e3 = tipo euribor a tres (3) meses de vencimiento.
1552,87,94,74,cambia ntemacioal (aci) complementars ala actual detición del po eurbor se considerarán,las definiciones relativas al tipo euribor que fueran aprobadas por la fbe y por la asociación
1553,92,101,75,intvogucdas alos efectos del tipo de inmés de referencia relato al go euribor al nacesaso de,"cambista internacional (aci) complementarias a la actual definición del tipo euribor, se considerarán"
1554,90,102,60,mosticación de los presentes términos de tipo de interés de relerencia i de noticación los,introducidas a los efectos del tipo de interés de referencia relativo al tipo euribor sin necesidad de
1555,41,97,74,vales de os bonos por la sacledad gestora,modificación de los presentes términos del tipo de interés de referencia ni de notificación a los
1556,98,47,74,ln en sl supuesto de usencia o imposbldad de obtención del po establecido en el apartado) anterior,titulares de los bonos por la sociedad gestora.
1557,83,108,79,+l tipo de ers de referencia sustulwo será lo de ierés que resul de efetas la meda.,"ii) en el supuesto de ausencia o imposibilidad de obtención del tipo establecido en el apartado i) anterior,"
1558,89,101,77,"grtmátca smpla de los tpos de interés intesencaros de olaa pera operacores de depósto no,",el tipo de interés de referencia sustitutivo será el tipo de interés que resulte de efectuar la media
1559,97,98,76,transterides en utos a 10 (3) mesos de vencimiento por un importe equivciont a saldo de principal,aritmética simple de los tipos de interés interbancarios de oferta para operaciones de depósito no
1560,97,103,80,"pendiente de a emisión de banos, que declaren cuatro (4) entidades bancarias de primer orden de a",transferibles en euros a tres (3) meses de vencimiento por un importe equivalente al saldo de principal
1561,94,99,75,"zona euro, previa sole simultanea ala sede píncpal de cada una de alas electueda por el agente","pendiente de la emisión de bonos, que declaren cuatro (4) entidades bancarias de primer orden de la"
1562,90,103,73,de pagos son posteranded y pronmiead a las 11:20 horas (hara cet) en la fecha de pacón 0el,"zona euro, previa solicitud simultánea a la sede principal de cada una de ellas efectuada por el agente"
1563,12,96,89,to e interés,de pagos con posterioridad y proximidad a las 11:00 horas (hora cet) en la fecha de fijación del
1564,91,16,76,"excepcionalmente, el tipo de interés de reerenciasustuto para el prime parado de devengo de",tipo de interés.
1565,90,99,77,"intereses será el que rest dela inorpolacón inca, contorme al iórmula del aparaco anterio.","excepcionalmente, el tipo de interés de referencia sustitutivo para el primer periodo de devengo de"
1566,86,105,69,entre el po de neréa que resae de efectuar la meda artmátca simple de ls 1pos de menes,"intereses será el que resulte de la interpolación lineal, conforme a la fórmula del apartado i) anterior,"
1567,90,99,74,intetbancaños de lena par operaciones de depósito no ransferies en guros a es (3) meses de,entre el tipo de interés que resulte de efectuar la media aritmética simple de los tipos de interés
1568,82,99,73,vencimiento y el ip de nteés que reso de elecas la meda amétca sample delos ips de,interbancarios de oferta para operaciones de depósito no transferibles en euros a tres (3) meses de
1569,91,99,77,interés intervencaros de oteia para operaciones de depósto no rarsferbles en suros a el (5),vencimiento y el tipo de interés que resulte de efectuar la media aritmética simple de los tipos de
1570,86,98,74,"meses de vencimiento, ambos para un impor equralente al impone nominal dela emisión de",interés interbancarios de oferta para operaciones de depósito no transferibles en euros a seis (6)
1571,90,91,70,"bonos, que declare la entados barcas según lo depuesto en el páralo anterior, previa socia","meses de vencimiento, ambos para un importe equivalente al importe nominal de la emisión de"
1572,82,103,75,smutánea a la sede píncpal de cada uns de elas clecuada por el agente ce pagos con,"bonos, que declaren las entidades bancarias según lo dispuesto en el párrafo anterior, previa solicitud"
1573,82,88,70,postroidad y proximidad a ls 1100 horas (ora cet) del dia hábi anerr a la fecha de,simultánea a la sede principal de cada una de ellas efectuada por el agente de pagos con
1574,10,92,86,desemboio.,posterioridad y proximidad a las 11:00 horas (hora cet) del día hábil anterior a la fecha de
1575,87,11,80,el to de inrés de reterencia usituwo se expresará en tanto porciento redordeando la cra,desembolso.
1576,44,98,74,"corespondente aa múésima, con eovstancla lla",el tipo de interés de referencia sustitutivo se expresará en tanto por ciento redondeando la cifra
1577,88,57,67,"en el supuesto de mpostscad de apcació del tio dé interés de reerenciasustuwo antro, por","correspondiente a la milésima, con equidistancia al alza."
1578,85,105,76,o sumar alguna o algunas de las anidades dancaras decsración de cotizaciones según lo,"en el supuesto de imposibilidad de aplicación del tipo de interés de referencia sustitutivo anterior, por"
1579,91,95,72,¿lspuesto en el prmer y segundo páralo de este aparado será de aplcacin el po de intrós que,no suministrar alguna o algunas de las entidades bancarias declaración de cotizaciones según lo
1580,87,100,73,ros.te e aplcar la meda ariménca simple dels ios de ner decarados por l menos dos de as,"dispuesto en el primer y segundo párrafo de este apartado, será de aplicación el tipo de interés que"
1581,94,104,79,li en ausencia o imposiblidad de cbtenció dels pos establecidos en ls apartados 1) y 1) amero.,resulte de aplicar la media aritmética simple de los tipos de interés declarados por al menos dos de las
1582,88,20,75,ser de spicación el limo tipo de ner de reerencia o su susto que hubiere sido splcado en,entidades restantes.
1583,85,109,83,sl parado de devengo ds interes imedatamente anterior y asi por penodos de devengo de,"iii) en ausencia o imposibilidad de obtención de los tipos establecidos en los apartados i) y ii) anteriores,"
1584,87,104,74,intereses sucesivos en anto en cuanto se mantenga ich suación. para el pimer periodo de,será de aplicación el último tipo de interés de referencia o su sustitutivo que hubiere sido aplicado en
1585,91,92,70,desengo d intereses ser el que reult dela interpolación inealconlome ala fórmula del aparto,"el periodo de devengo de intereses inmediatamente anterior, y así por periodos de devengo de"
1586,90,93,77,"1) anenor, entre l po eurbor a es ($) mes y el ipo euribor a seis (6) meses de vencimiento",intereses sucesivos en tanto en cuanto se mantenga dicha situación. para el primer periodo de
1587,85,103,72,dsponides inmedisamente ates delas 11-00 horas (cet) del día hába atesora la fecha de,"devengo de intereses será el que resulte de la interpolación lineal, conforme a la fórmula del apartado"
1588,85,99,79,"desenbolo, calculado y detbuldo conforme a lo descto en el primer páralo del apaado 1","i) anterior, entre el tipo euribor a tres (3) mes y el tipo euribor a seis (6) meses de vencimiento"
1589,3,94,92,as2,disponibles inmediatamente antes de las 11:00 horas (cet) del día hábil anterior a la fecha de
1590,92,95,76,"en cada una delas fechas de faión dello de interés, el agent de pagos comunicará la sociedad","desembolso, calculado y distribuido conforme a lo descrito en el primer párrafo del apartado i)"
1591,86,9,79,"gestor e io de interés d reteencia determinado de acusdo con los aparidos) a) ames, la",anterior.
1592,91,102,76,sociedad gestora conservar los istados y documentos activos en los que el agent de pagos le,"en cada una de las fechas de fijación del tipo de interés, el agente de pagos comunicará a la sociedad"
1593,48,106,73,«comunique el to de itrés de aetrenca deteminado,gestora el tipo de interés de referencia determinado de acuerdo con los apartados i) a iii) anteriores. la
1594,36,100,80,fecha de fjción del tipo de interés.,sociedad gestora conservará los listados y documentos acreditativos en los que el agente de pagos le
1595,90,55,68,el tipo de interés nominal splcable a bonos para cada periodo de devengo de intereses será,comunique el tipo de interés de referencia determinado.
1596,93,38,74,"eteminado por la sociedad gestora, en teresentacin y por cuenta del fondo, a la foma prevea n",fecha de fijación del tipo de interés.
1597,85,91,69,"los parados 412) 413 antenres.l segundo dia h bl aterra cada fecha de pago la “fecha,",el tipo de interés nominal aplicable a bonos para cada periodo de devengo de intereses será
1598,87,102,73,"de fjeción del tipo de imerés, y ser de apicación pera el sguente periodo de devengo de","determinado por la sociedad gestora, en representación y por cuenta del fondo, en la forma prevista en"
1599,0,89,89,,los asartados  \  anteriores el sejundo 'ta +ibil anterior a cada )echa de 3ajo la “fecha
1600,0,93,93,,de fijación del tipo de interés” \ seri de aslicación sara el siguiente periodo de devengo de
1601,10,10,0,intereses.,intereses.
1602,94,100,10,"excepcionalmente, el tipo de nterás nominal apícble a os bonos para l primar percdo de devengo","excepcionalmente, el tipo de interés nominal aplicable a los bonos para el primer periodo de devengo"
1603,91,103,13,de itreces lo deteminará la sociedad gestor enla forma previa en los aparados 48.12 y 481.3,de intereses lo determinará la sociedad gestora en la forma prevista en los apartados 4.8.1.2 y 4.8.1.3
1604,87,100,18,"gnteores, el dia hab amero ala fecha de desembolso lo comunicará ames de las 13:0 horas","anteriores, el día hábil anterior a la fecha de desembolso, y lo comunicará antes de las 13:00 horas"
1605,92,101,16,"(fora cet) del dí 4 de ula de 2014 ala entaad directora y ala entgad susceptora, asimámo, la","(hora cet) del día 4 de julio de 2014 a la entidad directora y a la entidad suscriptora. asimismo, la"
1606,84,91,11,"sociedad gestora tambien lo comunicar ala cnmv, l agente de pagos, a ajaf y iseroar.","sociedad gestora también lo comunicará a la cnmv, al agente de pagos, a aiaf y a iberclear."
1607,94,96,2,los tipos de interés nominales deteminados para bonos para ls sucesivos períodos de devengo de,los tipos de interés nominales determinados para bonos para los sucesivos períodos de devengo de
1608,94,102,11,"intereses, se comuricarán als itares de los bonos on el lazo y la foma previstos an el aparado","intereses, se comunicarán a los titulares de los bonos en el plazo y la forma previstos en el apartado"
1609,23,30,8,4.11) de módulo acciona,4.1.1.a) del módulo adicional.
1610,40,41,1,fórmula para el cálculo delos intereses.,fórmula para el cálculo de los intereses.
1611,97,101,7,"e cálculo de a iquidación de intereses correspondiente alos bonos, que nen de ser pagados an cada","el cálculo de la liquidación de intereses correspondiente a los bonos, que han de ser pagados en cada"
1612,93,101,12,"fecha de pago par cada perodo de devengo de intereses, so levar a cabo con anego a a squiento","fecha de pago para cada periodo de devengo de intereses, se llevará a cabo con arreglo a la siguiente"
1613,8,8,3,formada:,fórmula:
1614,3,6,5,n.9,donde:
1615,6,86,81,(=p hi,i  =  intereses a pagar en una fecha de pago determinada o en la fecha de liquidación.
1616,5,93,89,dona:,p =  saldo de principal pendiente de los bonos a la fecha de determinación precedente a dicha
1617,74,42,45,1 = inereses apagar en una fecha de pago determinada o ea echa de iuidaión,fecha de pago o a la fecha de liquidación.
1618,85,72,53,92 saldo de pmopel pendiente delos bonos a la fecha de determinación precedente a cha,r =  tipo de interés nominal de los bonos expresado en porcentaje anual.
1619,37,86,67,fecha de pago o ala fecha de iqudacón,d =  número de días efectivos que correspondan a cada periodo de devengo de intereses.
1620,63,71,55,a- tio de tres nominal e os bonos expresado en porcentaje anual,"fechas, lugar, entidades y procedimiento para el pago de los intereses."
1621,71,95,72,mero de días efectos que correspondan cada peredo de desengo de neeses.,los intereses de los bonos se pagarán hasta la amortización final de los mismos por periodos de
1622,67,105,79,"fechas, lugar entidades y procedimiento para el pago de los interes","devengo de intereses vencidos, los días 14 de enero, 14 de abril, 14 de julio y 14 de octubre de cada año"
1623,93,103,77,los intereses de los bonos se pagarán hasta la amorizacón final de los mismos por periados de,"o, en caso de que alguno de estos días no fuera un día hábil, el siguiente día hábil (cada una de estas"
1624,92,95,72,"detengo e intereses vencidos ls las 14 e enero, 14 de al, 14 de jul y 14 de ocre de cade año",fechas una “fecha de pago” devengándose los intereses correspondientes al periodo de devengo de
1625,86,100,75,"9, an aso de que aguno de eos días no fura un dia hab, l gun día hd! (cda una de estas","intereses en curso, hasta el mencionado primer día hábil, no incluido, con arreglo a las condiciones"
1626,92,62,65,"echas, una “fecha de pago'), devengándose lo intereses comespondntes al pesado de devengo de",fijadas en el apartado 4.8.1.2 de la presente nota de valores.
1627,91,91,73,"intereses en cuso, hasta el mencionado púer dia hábi, no ncudo, on arreglo alas condiciones","la primera fecha de pago de intereses para los bonos tendrá lugar el 14 de octubre de 2014,"
1628,55,99,72,macas an el apartado 4.12 dela presente nota de valores,"devengándose los mismos al tipo de interés nominal correspondiente desde la fecha de desembolso, el"
1629,90,71,60,"la primera fecha de pago de intereses para los bonos tendrá lugr el 14 de octubre de 2014,","8 de julio de 2014, incluido, hasta el 14 de octubre de 2014, excluido."
1630,94,99,76,"devangándose los mismos el tgo de inter nominal conespondente desde la fecha de desembolso, el",$ los efectos de la sresente (misión de %onos se considerarin dtas hibiles “días hábiles” todos los
1631,60,93,71,"8 e ulo de 2014, incio, asta el 14 de octubre de 2014, excl,",días que no sean inhábil del calendario target2 (o calendario que le sustituya en el futuro).
1632,99,106,77,"a los efectos de la presente emisión de bonos, se considerar n días h bles (“dias máblls) todos los","tanto los intereses que resulten a favor de los tenedores de los bonos, como, si fuera el caso, el importe"
1633,74,101,78,la queno sean iba del slendaio taroet2 ( calendar que e sustuya en efuuro),"de los intereses devengados y no satisfechos, se comunicarán a los mismos, en la forma descrita en el"
1634,89,104,79,"“tanto ls nteesos que resulten a favor dels tenedores delos bonos, como, ue e caso, el mp","apartado 4.1.1.a) del módulo adicional, y con una antelación de al menos un (1) día natural a cada fecha"
1635,89,8,84,"e os inreses devengados y n saisiecros, se comunicarán lo mismos, en la foma deteta en el",de pago.
1636,95,94,78,"apaado 4114) de módulo adicional, y con una amelación de al menos un (1) cl natural cada fecha,",el abono de los intereses devengados de los bonos tendrá lugar siempre que el fondo cuente con
1637,7,102,96,de vago,liquidez suficiente para ello en cada fecha de pago de acuerdo con el orden de prelación de pagos o en
1638,93,86,70,el abono de los imeresas devengados de los banos tenará lugar siempre que al fondo cuente con,la liquidación del fondo de acuerdo con el orden de prelación de pagos de liquidación.
1639,93,100,68,iidezsulcent para eo en cada focha de pago de acuerdo con el orden de prelación de pagos o en,"en caso de que en una fecha de pago, el fondo no pudiera hacer frente al pago total o parcial de los"
1640,80,101,52,la quidación del fondo de acuerdo con l orden de prelacón de pagos de lguidacón.,"intereses devengados por los bonos, de conformidad con el orden de prelación de pagos, las cantidades"
1641,95,92,76,"en caso de que en uns fecha de pago, el fondo no pusera hacer teme l pago total o parcial delos","no satisfechas, se acumularán en la siguiente fecha de pago a los intereses que, en su caso,"
1642,98,95,72,"intereses devengados por las soros, de conformidad cone orden de prelción de pages, ls cantidades.","corresponda abonar en esa misma fecha de pago, siendo pagados conforme al orden de prelación de"
1643,85,98,71,"o satstechas, se acumuisán en la sguieme fecha de pago a los meteses que, en su caso,",pagos y aplicados por orden de vencimiento en caso de que no fuera posible nuevamente ser abonados
1644,93,56,69,"fonecponda abonar en esa miema fecha de pago, siendo pagados contarme al orden de prlación de",en su totalidad por insuficiencia de fondos disponibles.
1645,94,101,77,pegos y alados por orden de vencimiento en caco de que o tura posible nuevamente ser abonados.,las cantidades no satisfechas de intereses vencidos no devengarán intereses adicionales o de demora y
1646,51,62,44,en su toallas por insulcenca de fondos disponibles.,no se acumularán al saldo de principal pendiente de los bonos.
1647,92,97,72,las canidades no sasechas de nerses vencidos no devergarón intereses aciconales ode demora y,"el fondo, a través de su sociedad gestora, no podrá aplazar el pago de intereses de los bonos con"
1648,54,98,71,ose acumular al sao de prncipal pendiente delos bonos.,"posterioridad al 14 de enero de 2057, fecha de vencimiento final, o si éste no fuera día hábil, el"
1649,95,20,85,"el fondo, a taués de su socedad gestora, no podrá aplazar el pago de intereses de los bonos con",siguiente día hábil.
1650,94,104,78,"posterioridad al 14 de enero de 2057, fecha de vencmiento final o sl éste n fuera día hádi, 6l","el servicio financiero de la emisión de bonos se realizará a través del agente de pagos, para lo cual la"
1651,16,98,85,siguiente da hab,"sociedad gestora, en nombre y representación del fondo, suscribirá el contrato de agencia de pagos"
1652,95,0,95,"el senicio nanciro d la emisión de bonos se realizará través del agente de pagos, paa o cual la",
1653,95,0,95,"sociedad gestora, en nombre y representación del fondo, suserora el contato de agencia de pagos",
1654,13,13,0,con barclays.,con barclays.
1655,49,51,4,"fecha de vencimiento y amontzación de os valores,",fecha de vencimiento y amortización de los valores.
1656,32,33,1,precio de reembolso delos bonos.,precio de reembolso de los bonos.
1657,97,103,9,"el precio de reembolso par los bonos será de cen má (100.00.00)suos por bono, equivalentes al 100","el precio de reembolso para los bonos será de cien mil (100.000,00) euros por bono, equivalentes al 100"
1658,84,98,21,"porciento desu elo nominal pagedero contarme alo establecido enel aparado 4.02 quen,","por ciento de su valor nominal, pagadero conforme a lo establecido en el apartado 4.9.2 siguiente."
1659,93,101,9,odos y cada uno de los bonos serán amorizados en gua cuanta mesant la reducción del nominal e,todos y cada uno de los bonos serán amortizados en igual cuantía mediante la reducción del nominal de
1660,16,18,3,cada uno de alos,cada uno de ellos.
1661,13,56,43,caracteristos,características específicas de la amortización de bonos.
