Ba BB,Para Moody’s los valores calificados Ba se considera que tienen
elementos especulativos; su futuro no es seguro. A menudo los pagos
de intereses y principal pueden estar muy modestamente protegidos
y, por lo tanto, ser vulnerables en el futuro. Estos valores se
caracterizan por su situación de incertidumbre.
Para S&P, este es un grado especulativo. No se puede considerar que
el futuro este asegurado. La protección del pago de intereses y del
principal es muy moderada.
B B,Para Moody’s los valores calificados B no tienen generalmente las
cualidades deseables como instrumentos de inversión. La seguridad
en el cumplimiento de los pagos de intereses o principal, u otros
compromisos contractuales, puede ser limitada a largo plazo.
Para S&P, la garantía de los pagos de interés o del principal puede ser
pequeña. Altamente vulnerables a las condiciones adversas del
negocio.
Caa CCC,Para Moody’s los valores calificados Caa son de baja calidad. Estos
valores pueden haber incumplido los pagos ya o pueden contener
elementos de peligro con respecto al cobro del capital e intereses.
Para S&P, vulnerabilidad identificada al incumplimiento.
Continuidad de los pagos dependiente de que las condiciones
financieras, económicas y de los negocios sean favorables.
Ca CC,Para Moody’s los valores calificados Ca son obligaciones altamente
especulativas. Estos valores han incumplido pagos frecuentemente o
tienen otras marcadas deficiencias.
Para S&P, son valores altamente especulativos.
C C,Para Moody’s los valores calificados C pertenecen a la categoría más
baja de los valores calificados y la posibilidad de que estos valores
alcancen alguna vez valor de inversión es remota.
Para S&P, el incumplimiento es inminente.
D,Valores especulativos. Su valor puede no exceder del valor de
reembolso en caso de liquidación o reorganización del sector.
