,,,Para Moody’s los títulos calificados Ca son obligaciones
altamente especulativas. Estas emisiones han incumplido
pagos frecuentemente o tienen otras marcadas
deficiencias.
C,C,C,Incumplimiento actual o inminente.
Para Moody’s los títulos calificados C pertenecen a la
categoría más baja de títulos calificados y la posibilidad de
que estas emisiones alcancen alguna vez valor de
inversión es remota.
D,,D,Valores especulativos. Su valor puede no exceder del valor
de reembolso en caso de liquidación o reorganización del
sector.
