BBB,Baa,BBB,La protección de los pagos de interés y del principal
puede ser moderada, la capacidad de pago se considera
adecuada. Las condiciones de negocio adversas
podrían conducir a una capacidad inadecuada para
hacer los pagos de interés y del principal.
Para Moody’s, los títulos calificados Baa se consideran
de calidad media (no están ni muy protegidos ni poco
respaldados). Los pagos de intereses y principal se
consideran adecuadamente protegidos pero algunos
elementos de protección pueden no existir o ser poco
fiables a largo plazo. Estos títulos carecen de
cualidades de excelencia como instrumentos de
inversión y de hecho también tienen características
especulativas.
BB,Ba,BB,Grado especulativo. No se puede considerar que el
futuro esté asegurado. La protección del pago de
intereses y del principal es muy moderada.
Para Moody’s, los títulos calificados Ba se considera
que contienen elementos especulativos; su futuro no
es seguro. A menudo los pagos de intereses y principal
pueden estar muy modestamente protegidos, y por lo
tanto, ser vulnerables en el futuro. Estos títulos se
caracterizan por su situación de incertidumbre.
B,B,B,La garantía de los pagos de interés o del principal
puede ser pequeña.
Altamente vulnerables a las condiciones adversas del
negocio.
Para Moody’s, los títulos calificados B no tienen
generalmente las cualidades deseables como
instrumentos de inversión. La seguridad en el
cumplimiento de los pagos de intereses o principal, u
otros compromisos contractuales, puede ser limitado
a largo plazo.
CCC,Caa,CCC,Vulnerabilidad identificada al incumplimiento.
Continuidad de los pagos dependiente de que las
condiciones financieras, económicas y de los negocios
sean favorables.
Para Moody’s, los títulos calificados Caa son de baja
calidad. Estas emisiones pueden haber incumplido los
pagos ya o pueden contener elementos de peligro con
respecto al cobro del capital e intereses.
CC,Ca,CC,Altamente especulativos.
Para Moody’s los valores calificados Ca son
obligaciones altamente especulativas. Estos valores
han incumplido pagos frecuentemente o tienen otras
marcadas deficiencias.
C,C,C,Incumplimiento actual o inminente.
Para Moody’s, los títulos calificados C pertenecen a la
categoría más baja de títulos calificados, y la
posibilidad de que estas emisiones alcancen alguna vez
valor de inversión es remota.
D,-,D,Valores especulativos. Su valor puede no exceder del
valor de reembolso en caso de liquidación o
reorganización del sector.
