,Gastos de constitución del Fondo y emisión de los Bonos,,,Importe,
Registro del Folleto en la CNMV,,,39.813,66,,
Supervisión del proceso de admisión a cotización en AIAF por la
CNMV,,,9.180,00,,
Tarifa de admisión a cotización en AIAF,,,52.200,00,,
Inclusión de la emisión en el registro de anotaciones en cuenta de
IBERCLEAR,,,3.480,00,,
Subtotal (gastos de admisión a cotización),,,104.673,66,,
Aranceles notariales, honorarios de auditoría, calificación, asesora-
miento legal, publicidad de la emisión, imprenta y otros,,,435.326,34,,
*Comisiones de aseguramiento y colocación de la emisión de Bonos.,,,960.000,00,,
Total gastos,,,1.500.000,00,,
