,Nombre,,,Cargo en sociedades cotizadas y/o relevantes,
D. Francisco Javier Consejero Delegado de EBN Banco de Negocios, S.A.
Soriano Arosa
Presidente del Consejo de EBN Capital, S.G.C.R., S.A.
Vocal del Consejo de Cartera Nuvalia, S.L.
Vocal del Consejo de Planiger, S.A.
Presidente del Consejo de Campus Patrimonial, S.A.
Vocal del Consejo de Grupo Hoteles Playa, S.A.,,,,,
D. Horacio Jefe del Departamento del Control de Riesgo de Caja de Ahorros
Mesonero Morales Municipal de Burgos.
Vocal del Consejo de Ahorro Gestión Hipotecario, E.F.C., S.A.
Vocal del Consejo de Inmobiliaria Burgoyal, S.A.
Vocal del Consejo de Europea de Desarrollos Urbanos, S.A.,,,,,
D. Francisco Javier Subdirector General de la División Financiera de Caja de Ahorros de
Sáiz Castilla La Mancha.
Vocal del Consejo de Ahorro Corporación Gestión, S.G.I.I.C., S.A.,,,,,
