,NOMBRE,,,CARGO EN OTRAS SOCIEDADES,
Consejero Delegado de “Corretaje e Información
D. Iñigo Trincado Boville
Monetaria y de Divisas, S.A”,,,,,
Director General de “Corretaje e Información
D. Rafael Bunzl Csonka
Monetaria y de Divisas, S.A”,,,,,
Consejero y Director General de Intermoney
Valores, S.V., S.A.
Presidente del Consejo de Wind to Market, S.A.
D. Javier de la Parte Rodríguez
Consejero de Intermoney Energía, S.A.
Consejero de Intermoney Valora Consulting, S.A.,,,,,
Directora Departamento de Control de “Corretaje e
Dª Beatríz Senís Gilmartín
Información Monetaria y de Divisas, S.A”,,,,,
