,Formalización,,
Préstamo no
Hipotecario,,Como norma general los préstamos se formalizan en póliza intervenida por fedatario público,
aunque está permitido formalizar sin intervención notarial las operaciones de importe hasta
30.000 € sin garantías pignoraticias.
Los préstamos preconcedidos formalizados en canal no presencial están limitados a 30.000 € y no
se intervienen.
Con anterioridad a marzo de 2015 los préstamos a interés fijo también podían formalizarse
mediante la incorporación de las obligaciones de pago del capital y de los intereses pendientes a
un pagaré a la vista, no a la orden, emitido por el prestatario, a favor de CaixaBank. En este caso
no hay intervención, ya que el pagaré incorpora la fuerza ejecutiva.
Los préstamos concedidos mediante canal presencial son aquellos que se han formalizado en la
oficina bancaria mientras que los no presenciales son aquellos que se han formalizado mediante
canales telemáticos.,
Préstamo Hipotecario,,Se formaliza mediante otorgamiento de escritura pública, que se inscribe en el registro de la
propiedad.,
Crédito no Hipotecario,,Se formaliza en póliza intervenida por fedatario público.,
Crédito Hipotecario,,El Crédito Hipotecario y la disposición inicial del mismo se formalizan mediante otorgamiento de
escritura pública, que se inscribe en el registro de la propiedad.
Las posteriores disposiciones del Crédito Hipotecario se formalizan en documento privado, al
amparo de la escritura del crédito o, en algunos casos, mediante canal no presencial.,
